{
  "id": "ltx-2.5-distilled",
  "name": "LTX-2.5 22B Distilled",
  "engine": "ltx25",
  "version": "0.1",
  "capabilities": {
    "tasks": ["video"],
    "inputs": ["text"],
    "audio_output": true,
    "profiles": ["quality", "balanced", "preview"],
    "execution": ["gpu", "gpu_ane"],
    "native_frames": 97,
    "native_fps": 24,
    "recommended_width": 704,
    "recommended_height": 480,
    "recommended_frames": 97,
    "recommended_fps": 24,
    "recommended_steps": 11
  },
  "config": {
    "info_executable_path": "${WORKSPACE}/ltx-mac/build/ltx",
    "gpu_executable_path": "${WORKSPACE}/ltx-mac/build/bench_block_mlx",
    "hybrid_executable_path": "${WORKSPACE}/ltx-mac/build/bench_block_mlx_ane",
    "transformer_path_candidates": [
      "${LTX_TRANSFORMER}",
      "${TURBOCIDER_MODELS}/LTX-2.5/diffusion_models/ltx-2.5-22b-distilled-transformer-comfy-int8-convrot.safetensors",
      "${HOME}/ComfyUI-Shared/models/diffusion_models/ltx-2.5-22b-distilled-transformer-comfy-int8-convrot.safetensors"
    ],
    "upsampler_path_candidates": [
      "${LTX_UPSAMPLER}",
      "${TURBOCIDER_MODELS}/LTX-2.5/latent_upscale_models/ltx-2.5-latent-spatial-upscaler-x2-bf16-1.0.safetensors",
      "${HOME}/ComfyUI-Shared/models/latent_upscale_models/ltx-2.5-latent-spatial-upscaler-x2-bf16-1.0.safetensors"
    ],
    "video_vae_path_candidates": [
      "${LTX_VIDEO_VAE}",
      "${TURBOCIDER_MODELS}/LTX-2.5/vae/ltx-2.5-video-vae-conv-bf16.safetensors",
      "${HOME}/ComfyUI-Shared/models/vae/ltx-2.5-video-vae-conv-bf16.safetensors"
    ],
    "text_encoder_path_candidates": [
      "${LTX_TEXT_ENCODER}",
      "${TURBOCIDER_MODELS}/LTX-2.5/text_encoders/gemma4-12b-with-proj-ltx-2.5-comfy-int8-convrot.safetensors",
      "${HOME}/ComfyUI-Shared/models/text_encoders/gemma4-12b-with-proj-ltx-2.5-comfy-int8-convrot.safetensors"
    ],
    "audio_vae_path_candidates": [
      "${LTX_AUDIO_VAE}",
      "${TURBOCIDER_MODELS}/LTX-2.5/vae/ltx-2.5-audio-vae-bf16.safetensors",
      "${HOME}/ComfyUI-Shared/models/vae/ltx-2.5-audio-vae-bf16.safetensors"
    ],
    "conditioning_directory_candidates": [
      "${LTX_CONDITIONING_DIR}",
      "${WORKSPACE}/ltx-mac/outputs/conditioning/coastal_runner/connected"
    ],
    "comfy_root_candidates": [
      "${COMFYUI_ROOT}",
      "${HOME}/ComfyUI-Installs/ComfyUI/ComfyUI"
    ],
    "comfy_python_path_candidates": [
      "${COMFYUI_PYTHON}",
      "${HOME}/ComfyUI-Installs/ComfyUI/ComfyUI/.venv/bin/python"
    ],
    "mlx_python_path_candidates": [
      "${LTX_MLX_PYTHON}",
      "${WORKSPACE}/ltx-mac/.venv-mlx/bin/python"
    ],
    "ane_mlp_stage1_directory_candidates": [
      "${TURBOCIDER_MODELS}/coreml/ltx-2.5/mlp/stage1",
      "${WORKSPACE}/ltx-mac/models/coreml/ltx_mlp_a6912_int8_samples/stage1"
    ],
    "ane_mlp_stage2_directory_candidates": [
      "${TURBOCIDER_MODELS}/coreml/ltx-2.5/mlp/stage2",
      "${WORKSPACE}/ltx-mac/models/coreml/ltx_mlp_a6912_int8_samples/stage2"
    ],
    "ane_kv_directory_candidates": [
      "${TURBOCIDER_MODELS}/coreml/ltx-2.5/text-kv-r1024",
      "${WORKSPACE}/ltx-mac/models/coreml/ltx_text_kv_all48_int8"
    ],
    "ane_kv_r256_directory_candidates": [
      "${TURBOCIDER_MODELS}/coreml/ltx-2.5/text-kv-r256",
      "${WORKSPACE}/ltx-mac/models/coreml/ltx_text_kv_r256_all48_int8"
    ]
  },
  "preparation": {
    "runtime_model_directory": "${TURBOCIDER_MODELS}/LTX-2.5",
    "python_candidates": [
      "${LTX_COREML_PYTHON}",
      "${WORKSPACE}/gpu_ane/flux2-runtime/.venv/bin/python"
    ],
    "sources": [
      {
        "role": "model",
        "repo_id": "Lightricks/LTX-2.5",
        "revision": "5e6e71018ee1756ed329b697a7b4aedc934dfce9",
        "destination": "${TURBOCIDER_MODELS}/LTX-2.5",
        "allow_patterns": [
          "diffusion_models/ltx-2.5-22b-distilled-transformer-comfy-int8-convrot.safetensors",
          "latent_upscale_models/ltx-2.5-latent-spatial-upscaler-x2-bf16-1.0.safetensors",
          "text_encoders/gemma4-12b-with-proj-ltx-2.5-comfy-int8-convrot.safetensors",
          "vae/ltx-2.5-video-vae-conv-bf16.safetensors",
          "vae/ltx-2.5-audio-vae-bf16.safetensors"
        ],
        "required_paths": [
          "diffusion_models/ltx-2.5-22b-distilled-transformer-comfy-int8-convrot.safetensors",
          "latent_upscale_models/ltx-2.5-latent-spatial-upscaler-x2-bf16-1.0.safetensors",
          "text_encoders/gemma4-12b-with-proj-ltx-2.5-comfy-int8-convrot.safetensors",
          "vae/ltx-2.5-video-vae-conv-bf16.safetensors",
          "vae/ltx-2.5-audio-vae-bf16.safetensors"
        ],
        "estimated_download_bytes": 42949672960,
        "max_workers": 8
      }
    ],
    "ane": {
      "transformer_subpath": "diffusion_models/ltx-2.5-22b-distilled-transformer-comfy-int8-convrot.safetensors",
      "mlp_tool": "${WORKSPACE}/ltx-mac/tools/export_ane_mlp_blocks.py",
      "kv_tool": "${WORKSPACE}/ltx-mac/tools/export_ane_kv_blocks.py",
      "output_directory": "${TURBOCIDER_MODELS}/coreml/ltx-2.5",
      "mlp_estimated_bytes": 9663676416,
      "kv_estimated_bytes": 2147483648
    }
  },
  "plans": [
    {
      "id": "ltx25.gpu.dense",
      "execution": "gpu",
      "quality": "exact",
      "profile": "*",
      "production": true,
      "priority": 100,
      "description": "Dense attention and full 1024-row context on Metal/MLX",
      "requirements": {
        "config_paths": ["gpu_executable_path", "transformer_path", "upsampler_path", "video_vae_path", "conditioning_directory"]
      }
    },
    {
      "id": "ltx25.gpu_ane.dense.480p",
      "execution": "gpu_ane",
      "quality": "validated",
      "profile": "quality",
      "production": true,
      "priority": 130,
      "description": "Validated Video MLP split and text K/V ANE plan for the 1001/4004-row workload",
      "requirements": {
        "config_paths": ["hybrid_executable_path", "transformer_path", "upsampler_path", "video_vae_path", "conditioning_directory", "ane_mlp_stage1_directory", "ane_mlp_stage2_directory", "ane_kv_directory"],
        "shapes": [{"width": 704, "height": 480, "frames": 97, "fps": 24}],
        "device_profiles": ["apple-m4-max-40gpu-64gb"]
      },
      "environment": {
        "LTX_AV_PARALLEL_GPU": "1",
        "LTX_ANE_MLP_STAGE1_DIR": "${WORKSPACE}/ltx-mac/models/coreml/ltx_mlp_a6912_int8_samples/stage1",
        "LTX_ANE_MLP_STAGE2_DIR": "${WORKSPACE}/ltx-mac/models/coreml/ltx_mlp_a6912_int8_samples/stage2",
        "LTX_ANE_MLP_VARIANT": "int8_pc",
        "LTX_ANE_MLP_RELEASE_FULL_GPU": "1",
        "LTX_ANE_KV_DIR": "${WORKSPACE}/ltx-mac/models/coreml/ltx_text_kv_all48_int8",
        "LTX_ANE_KV_VARIANT": "int8_pc",
        "LTX_ANE_KV_STAGE1": "1",
        "LTX_ANE_KV_STAGE2": "0"
      },
      "metadata": {
        "ltx_ane_paths": {
          "LTX_ANE_MLP_STAGE1_DIR": "ane_mlp_stage1_directory",
          "LTX_ANE_MLP_STAGE2_DIR": "ane_mlp_stage2_directory",
          "LTX_ANE_KV_DIR": "ane_kv_directory"
        }
      }
    },
    {
      "id": "ltx25.gpu_ane.fast.480p",
      "execution": "gpu_ane",
      "quality": "experimental",
      "profile": "preview",
      "production": false,
      "priority": 140,
      "description": "Explicit text256 plus Stage-2 Sol approximate route",
      "requirements": {
        "config_paths": ["hybrid_executable_path", "transformer_path", "upsampler_path", "video_vae_path", "conditioning_directory", "ane_mlp_stage1_directory", "ane_mlp_stage2_directory", "ane_kv_r256_directory"],
        "shapes": [{"width": 704, "height": 480, "frames": 97, "fps": 24}],
        "device_profiles": ["apple-m4-max-40gpu-64gb"]
      },
      "environment": {
        "LTX_AV_PARALLEL_GPU": "1",
        "LTX_ANE_MLP_STAGE1_DIR": "${WORKSPACE}/ltx-mac/models/coreml/ltx_mlp_a6912_int8_samples/stage1",
        "LTX_ANE_MLP_STAGE2_DIR": "${WORKSPACE}/ltx-mac/models/coreml/ltx_mlp_a6912_int8_samples/stage2",
        "LTX_ANE_MLP_VARIANT": "int8_pc",
        "LTX_ANE_MLP_RELEASE_FULL_GPU": "1",
        "LTX_ANE_KV_DIR": "${WORKSPACE}/ltx-mac/models/coreml/ltx_text_kv_r256_all48_int8",
        "LTX_ANE_KV_VARIANT": "int8_pc",
        "LTX_ANE_KV_STAGE1": "1",
        "LTX_ANE_KV_STAGE2": "1",
        "LTX_TEXT_ROWS_LIMIT": "256",
        "LTX_SOL_VIDEO_SELF_STAGE2": "1",
        "LTX_SOL_DENSE_EDGE_BLOCKS": "1",
        "LTX_SOL_DENSE_EDGE_STEPS": "0",
        "LTX_SOL_TAU": "1.0"
      },
      "metadata": {
        "ltx_ane_paths": {
          "LTX_ANE_MLP_STAGE1_DIR": "ane_mlp_stage1_directory",
          "LTX_ANE_MLP_STAGE2_DIR": "ane_mlp_stage2_directory",
          "LTX_ANE_KV_DIR": "ane_kv_r256_directory"
        }
      }
    }
  ]
}
